{
  "name": "Goblin Troubles in Vedant Forest",
  "startNode": "forest-path",
  "metadata": {
    "author": "Eidolon Team",
    "description": "Clear the goblin menace from the ancient forest paths",
    "tags": ["combat", "goblins", "forest", "tutorial"],
    "version": "1.0.0",
    "createdAt": "2025-07-01T00:00:00Z"
  },
  "passages": [
    {
      "id": "forest-path",
      "name": "Forest Path Ambush",
      "text": "The well-trodden path through Vedant Forest suddenly feels less safe. Three goblin scouts emerge from behind the dense trees, their crude weapons glinting in the filtered sunlight. The cool, damp air carries their foul stench as they block your way forward.",
      "links": [
        {
          "text": "Fight the goblin scouts",
          "target": "Small Clearing Battle",
          "targetId": "small-clearing"
        }
      ],
      "gameData": {
        "duration": 300,
        "requirements": {
          "resources": {
            "supplies": 2
          }
        },
        "challenge": {
          "skill": "Melee",
          "attribute": "Strength",
          "difficulty": 3
        },
        "outcomes": {
          "criticalSuccess": {
            "text": "Your swift strikes scatter the scouts before they can coordinate. They flee, dropping a pouch of stolen coins.",
            "rewards": {
              "resources": {
                "gold": 15
              },
              "skillXP": {
                "Melee": 0.5
              }
            }
          },
          "success": {
            "text": "You defeat the three goblins after a brief skirmish. They retreat into the forest, leaving behind some gold.",
            "rewards": {
              "resources": {
                "gold": 10
              },
              "skillXP": {
                "Melee": 0.25
              }
            }
          },
          "failure": {
            "text": "The goblins overwhelm you with their numbers. You drive them off, but they steal some supplies.",
            "penalties": {
              "resources": {
                "supplies": 2
              }
            }
          },
          "criticalFailure": {
            "text": "The ambush catches you completely off guard. You escape, but not without losses.",
            "penalties": {
              "resources": {
                "supplies": 3,
                "gold": 5
              }
            }
          }
        },
        "restAllowed": true,
        "abandonPenalty": {
          "resources": {
            "gold": 5
          }
        }
      }
    },
    {
      "id": "small-clearing",
      "name": "Small Clearing Battle",
      "text": "You pursue the fleeing scouts into a small clearing where wildflowers once grew peacefully. Now, five goblin warriors await you, having trampled the colorful blooms underfoot. The buzz of insects is drowned out by their guttural war cries.",
      "links": [
        {
          "text": "Engage the goblin warriors",
          "target": "Ancient Oak Stand",
          "targetId": "ancient-oak"
        }
      ],
      "gameData": {
        "duration": 450,
        "requirements": {
          "resources": {
            "supplies": 3
          }
        },
        "challenge": {
          "skill": "Dodge",
          "attribute": "Agility",
          "difficulty": 5
        },
        "outcomes": {
          "criticalSuccess": {
            "text": "You weave through their attacks like wind through trees. The goblins stumble over each other, making them easy targets.",
            "rewards": {
              "resources": {
                "gold": 25,
                "supplies": 2
              },
              "skillXP": {
                "Dodge": 0.75
              }
            }
          },
          "success": {
            "text": "Your agile movements keep you safe from most attacks. The warriors retreat, abandoning their supplies.",
            "rewards": {
              "resources": {
                "gold": 20,
                "supplies": 1
              },
              "skillXP": {
                "Dodge": 0.4
              }
            }
          },
          "failure": {
            "text": "The warriors coordinate better than expected. You escape, but they land several hits.",
            "penalties": {
              "resources": {
                "supplies": 4
              }
            }
          },
          "criticalFailure": {
            "text": "Surrounded in the clearing, you barely escape the goblin warriors' coordinated assault.",
            "penalties": {
              "resources": {
                "supplies": 5,
                "gold": 10
              }
            }
          }
        },
        "restAllowed": true,
        "abandonPenalty": {
          "resources": {
            "gold": 10
          }
        }
      }
    },
    {
      "id": "ancient-oak",
      "name": "Ancient Oak Stand",
      "text": "The goblins have made their camp beneath the ancient oak, defiling this sacred place with their presence. Seven raiders sharpen their weapons on the gnarled roots. Their leader, wearing a necklace of acorns, rises to face you. This ends here.",
      "links": [
        {
          "text": "Defeat the goblin raiders",
          "target": "Forest Restored",
          "targetId": "victory"
        }
      ],
      "gameData": {
        "duration": 600,
        "requirements": {
          "resources": {
            "supplies": 5
          }
        },
        "challenge": {
          "skill": "Brawling",
          "attribute": "Endurance",
          "difficulty": 7
        },
        "outcomes": {
          "criticalSuccess": {
            "text": "Your furious assault breaks their morale. The leader falls, and his raiders scatter into the deep forest, leaving behind their accumulated plunder.",
            "rewards": {
              "resources": {
                "gold": 50,
                "supplies": 5
              },
              "skillXP": {
                "Brawling": 1.0
              },
              "progress": {
                "forestCleared": true
              }
            }
          },
          "success": {
            "text": "After a brutal melee, you stand victorious. The surviving goblins flee, abandoning their ill-gotten treasures.",
            "rewards": {
              "resources": {
                "gold": 35,
                "supplies": 3
              },
              "skillXP": {
                "Brawling": 0.6
              },
              "progress": {
                "forestCleared": true
              }
            }
          },
          "failure": {
            "text": "The raiders prove too strong. You retreat, but at least you've disrupted their camp.",
            "penalties": {
              "resources": {
                "supplies": 6,
                "gold": 15
              }
            }
          },
          "criticalFailure": {
            "text": "The goblin leader's savage tactics overwhelm you. You flee in defeat.",
            "penalties": {
              "resources": {
                "supplies": 8,
                "gold": 20
              }
            }
          }
        },
        "restAllowed": false,
        "abandonPenalty": {
          "resources": {
            "gold": 15
          }
        }
      }
    },
    {
      "id": "victory",
      "name": "Forest Restored",
      "text": "With the goblins routed, peace returns to Vedant Forest. The ancient oak stands tall once more, no longer defiled by the raiders' presence. Birds return to sing in the branches, and the forest path is safe for travelers again.",
      "links": [],
      "gameData": {
        "duration": 60,
        "requirements": {},
        "challenge": {
          "skill": "Foraging",
          "attribute": "Perception",
          "difficulty": 1
        },
        "outcomes": {
          "success": {
            "text": "You search the abandoned camp and find a final hidden cache of goblin treasure.",
            "rewards": {
              "resources": {
                "gold": 10
              },
              "progress": {
                "storyComplete": true
              }
            }
          },
          "failure": {
            "text": "The forest is clear, and your work here is done.",
            "rewards": {
              "resources": {
                "gold": 5
              },
              "progress": {
                "storyComplete": true
              }
            }
          }
        },
        "restAllowed": false
      }
    }
  ],
  "globalSettings": {
    "restDuration": 3600,
    "defaultAbandonPenalty": {
      "resources": {
        "gold": 5
      }
    }
  }
}
